{
  "configurationPath": "configuration.json",
  "jsPath": "index.js",
  "htmlPath": "index.ftl",
  "cssPath": "index.css",
  "icon": "bolt",
  "name": "Profile Summary (Dashboard) (DEPRECATED)",
  "description": "DEPRECATED: This fragment relies on legacy serviceLocator patterns. Use modern Data Providers instead.",
  "type": "component"
}
