{
  "configurationPath": "configuration.json",
  "jsPath": "index.js",
  "htmlPath": "index.html",
  "cssPath": "index.css",
  "icon": "bolt",
  "name": "Hidden Relationship",
  "typeOptions": {
    "fieldTypes": [
      "relationship"
    ]
  },
  "type": "input",
  "thumbnailPath": "thumbnail.png"
}
