{
  "configurationPath": "configuration.json",
  "jsPath": "index.js",
  "htmlPath": "index.html",
  "cssPath": "index.css",
  "icon": "account-circle",
  "name": "Profile Summary (DEPRECATED)",
  "description": "DEPRECATED: This fragment relies on legacy serviceLocator patterns. Use modern Data Providers instead.",
  "type": "component",
  "thumbnailPath": "thumbnail.png"
}
